Exercise Name,Muscle Group,Exercise Image URL,Muscles Worked Image,Commentary,Page URL,Avg Rep,Avg Break
Side Lunges (Bodyweight),Leg,https://i0.wp.com/www.strengthlog.com/wp-content/uploads/2020/06/Side-lunges.gif?resize=566%2C566&ssl=1,,"Side lunges is a variant of the body weight lunge. The lunge is a body weight exercise that not only strengthens your leg muscles, but it can also be used to train your balance, coordination and control. Side lunges is an appropriate exercise to perform at home, since it is quite challenging even without extra weight. If you want to make it more challenging, you can add one or two dumbbells to your hands.",https://www.strengthlog.com/side-lunges-bodyweight/,4,120
Smith Machine Bulgarian Split Squat,Leg,https://i0.wp.com/www.strengthlog.com/wp-content/uploads/2024/11/smith-machine-bss.gif?resize=600%2C600&ssl=1,,"The bulgarian split squat is an exercise that offers plenty of benefits. The exercise trains your thighs and glutes hard while also training your control and stability in your knees and hips. Because the load is placed on one leg at a time, the activation increases in your core muscles, particularly the ones at your sides.",https://www.strengthlog.com/smith-machine-bulgarian-split-squat/,5,180
Smith Machine Front Squat,Leg,https://i0.wp.com/www.strengthlog.com/wp-content/uploads/2024/11/Smith-machine-front-squat.gif?resize=600%2C600&ssl=1,https://i0.wp.com/www.strengthlog.com/wp-content/uploads/2024/11/muscles-worked-Smith-machine-front-squat.png?resize=700%2C700&ssl=1,"The front squat is a variation of the barbell squat. This exercise shifts more work to your quadriceps, and also your back muscles have to work against a longer moment arm. By performing it in the Smith Machine, you’ll get added stability to the movement. Because the center of gravity is shifted forward compared to a regular squat, many find it easier to get deep in the front squat. However, the mobility demands increase in other joints, such as your ankles (which can be helped by lifting shoes with a raised heel) and in your shoulders and wrists. The latter might be solved by using an alternate grip: either by crossing your lower arms and placing your hands on top of the bar or by pulling lifting straps around the bar and holding onto these.",https://www.strengthlog.com/smith-machine-front-squat/,5,180
Smith Machine Squat,Leg,https://i0.wp.com/www.strengthlog.com/wp-content/uploads/2020/04/smith-machine-squat.gif?resize=600%2C600&ssl=1,https://i0.wp.com/www.strengthlog.com/wp-content/uploads/2020/10/Muscles-worked-by-Smith-Machine-Squat.png?resize=700%2C700&ssl=1,"Smith machine squats differ from the free barbell squat primarily by its completely straight bar path, something that only happens in the free barbell squat when the bar is loaded with several times the lifter’s body weight. The fixed bar path lowers the requirements of balance and stabilization and might enable an increased focus on the muscles being trained.",https://www.strengthlog.com/smith-machine-squat/,5,180
Squat,Leg,https://i0.wp.com/www.strengthlog.com/wp-content/uploads/2021/11/squat.gif?resize=600%2C600&ssl=1,https://i0.wp.com/www.strengthlog.com/wp-content/uploads/2020/05/Squat-muscles-worked.png?resize=700%2C700&ssl=1,,https://www.strengthlog.com/squat/,5,180
Step Up,Leg,https://i0.wp.com/www.strengthlog.com/wp-content/uploads/2021/03/step-up-exercise.gif?resize=600%2C600&ssl=1,https://i0.wp.com/www.strengthlog.com/wp-content/uploads/2021/01/Muscles-worked-by-step-up.png?resize=700%2C700&ssl=1,"Step-ups have been shown to activate gluteus maximus even more than squats and hip thrusts do.1 It is a great exercise to do at home, since it is challenging even without weights. If you train at home, you can step up on whatever furniture you have at hand – a chair, a stair step or a bench, for example. However, if you want to make the exercise heavier, you can perform it with a pair of dumbbells or a barbell as well, as shown below.",https://www.strengthlog.com/step-up/,4,120
Zercher Squat,Leg,https://i0.wp.com/www.strengthlog.com/wp-content/uploads/2023/11/zercher-squat.gif?resize=600%2C600&ssl=1,,,https://www.strengthlog.com/zercher-squat/,5,180
Zombie Squat,Leg,https://i0.wp.com/www.strengthlog.com/wp-content/uploads/2024/10/zombie-squat.gif?resize=600%2C600&ssl=1,https://i0.wp.com/www.strengthlog.com/wp-content/uploads/2020/09/Muscles-worked-in-the-front-squat-exercise-1024x1024.jpg?resize=700%2C700&ssl=1,"Zombie squats are a variation of front squat where the barbell balances on the front of your shoulders by you keeping the arms out straight in front of you. This is an exercise where you should start with an empty barbell or just a wooden stick, and then increase the weight very carefully.",https://www.strengthlog.com/zombie-squat/,5,180
Assisted Chin-Up,Back,https://i0.wp.com/www.strengthlog.com/wp-content/uploads/2024/02/assisterade-chins-med-omvant-grepp.gif?resize=600%2C600&ssl=1,https://i0.wp.com/www.strengthlog.com/wp-content/uploads/2020/10/Muscles-worked-by-chin-ups.png?resize=700%2C700&ssl=1,"Chin-ups train both your lats and arm flexors effectively. With a supinated grip like in this exercise, you make it possible to focus even more on your arm flexors, if you want to. Assisted chin-ups are a good alternative if the chin-up is too heavy or if you want to be able to do more reps without adding too much workload. Many people are slightly stronger in this variation than in regular pull-ups (with a pronated grip), which makes this a good step on the way, or entry-level exercise, for you who are training to do your first pull-up.",https://www.strengthlog.com/assisted-chin-up/,4,120
Assisted Pull-Up,Back,https://i0.wp.com/www.strengthlog.com/wp-content/uploads/2024/02/assisterade-chins.gif?resize=600%2C600&ssl=1,https://i0.wp.com/www.strengthlog.com/wp-content/uploads/2020/10/Muscles-worked-by-chin-ups.png?resize=700%2C700&ssl=1,"Pull-ups train both your lats and arm flexors effectively. By using a grip slightly wider than shoulder-width, you get a good range of motion and high muscle activation in all the working muscles. Assisted pull-ups are a good alternative if the pull-up is too heavy or if you want to be able to do more reps without adding too much workload.",https://www.strengthlog.com/assisted-pull-up/,4,120
Back Extension,Back,https://i0.wp.com/www.strengthlog.com/wp-content/uploads/2020/05/back-extension-frontloaded.gif?resize=600%2C600&ssl=1,https://i0.wp.com/www.strengthlog.com/wp-content/uploads/2020/10/Muscles-worked-by-back-extension-1024x1024.png?resize=700%2C700&ssl=1,,https://www.strengthlog.com/back-extension/,5,120
Banded Muscle-Up,Back,https://i0.wp.com/www.strengthlog.com/wp-content/uploads/2024/02/Banded-Muscle-Up.gif?resize=600%2C600&ssl=1,https://i0.wp.com/www.strengthlog.com/wp-content/uploads/2024/02/Muscles-worked-in-bar-muscle-up.png?resize=563%2C563&ssl=1,,https://www.strengthlog.com/banded-muscle-up/,5,180
Barbell Row,Back,https://i0.wp.com/www.strengthlog.com/wp-content/uploads/2022/03/Barbell-Row.gif?resize=600%2C600&ssl=1,https://i0.wp.com/www.strengthlog.com/wp-content/uploads/2023/01/Barbell-row-muscles-worked.png?resize=563%2C563&ssl=1,,https://www.strengthlog.com/barbell-row/,5,180
Barbell Shrug,Back,https://i0.wp.com/www.strengthlog.com/wp-content/uploads/2020/03/Barbell-Shrug.gif?resize=600%2C600&ssl=1,https://i0.wp.com/www.strengthlog.com/wp-content/uploads/2020/10/Muscles-worked-by-barbell-shrug.png?resize=700%2C700&ssl=1,"The shrug is an isolation exercise for the muscles that lifts and supports your shoulder girdle, like the top portion of your trapezius among others. Dumbbells, barbell, and trap bar are all common tools for this exercise.",https://www.strengthlog.com/barbell-shrug/,5,120
Block Clean,Back,https://i0.wp.com/www.strengthlog.com/wp-content/uploads/2024/02/block-clean.gif?resize=600%2C600&ssl=1,https://i0.wp.com/www.strengthlog.com/wp-content/uploads/2020/10/Muscles-worked-by-clean-exercise-1024x1024.png?resize=700%2C700&ssl=1,"The block clean is a variant of the clean exercise, in which you have removed the first pull from the floor. This makes it a potentially easier variant to begin with for learning the clean since you don’t have to focus on as many steps.",https://www.strengthlog.com/block-clean/,5,180
Block Snatch,Back,https://i0.wp.com/www.strengthlog.com/wp-content/uploads/2021/01/block-snatch.gif?resize=600%2C600&ssl=1,https://i0.wp.com/www.strengthlog.com/wp-content/uploads/2021/01/Muscles-worked-in-the-block-snatch-exercise-1024x1024.png?resize=700%2C700&ssl=1,"The block snatch is a variant of the snatch exercise, in which you have removed the first pull from the floor. This makes the block snatch a potentially easier variant to begin with for learning the snatch, since you don’t have to focus on as many steps.",https://www.strengthlog.com/block-snatch/,5,180
Cable Close Grip Seated Row,Back,https://i0.wp.com/www.strengthlog.com/wp-content/uploads/2020/03/cable-row-seated-narrow-grip.gif?resize=600%2C600&ssl=1,,,https://www.strengthlog.com/cable-close-grip-seated-row/,5,120
Cable Wide Grip Seated Row,Back,https://i0.wp.com/www.strengthlog.com/wp-content/uploads/2020/03/cable-row-seated-wide-grip.gif?resize=600%2C600&ssl=1,https://i0.wp.com/www.strengthlog.com/wp-content/uploads/2020/10/Muscles-worked-by-seated-cable-row-with-wide-grip.png?resize=700%2C700&ssl=1,"Lean forward slightly in the starting position, and lean back slightly in the end position. Let your scapulae move freely by letting them slide forward in the starting position, and pull them back in the end position. Cable rows can be done with a wide or close grip, and most people find that they get better contact with their biceps with the close grip, and better contact with their back muscles with the wide grip.",https://www.strengthlog.com/cable-wide-grip-seated-row/,5,120
Chest to Bar,Back,https://i0.wp.com/www.strengthlog.com/wp-content/uploads/2024/10/chest-to-bar.gif?resize=600%2C600&ssl=1,https://i0.wp.com/www.strengthlog.com/wp-content/uploads/2024/10/muscles-worked-chest-to-bar.png?resize=700%2C700&ssl=1,"Chest to Bar is a variation of pull-ups/chin-ups that require more strength and explosiveness than regular version of the exercise. They also demand greater shoulder mobility and scapular control. Additionally, they help improve body coordination and control, as you must pull yourself to a higher point compared to standard pull-ups.",https://www.strengthlog.com/chest-to-bar/,4,120
Chin-Up,Back,https://i0.wp.com/www.strengthlog.com/wp-content/uploads/2020/03/chin-up.gif?resize=600%2C600&ssl=1,https://i0.wp.com/www.strengthlog.com/wp-content/uploads/2020/10/Muscles-worked-by-chin-ups.png?resize=700%2C700&ssl=1,"Chin-ups train both your lats and arm flexors effectively. With a supinated grip like in this exercise, you make it possible to focus even more on your arm flexors, if you want to. You can make the exercise heavier by adding extra weight, i.e. in a weight belt, or make it easier by slinging a rubber band around the bar and under your feet. Many people are slightly stronger in this variation than in regular pull-ups (with a pronated grip), which makes this a good step on the way, or entry-level exercise, for you who are training to do your first pull-up.",https://www.strengthlog.com/chin-up/,4,120
Clean,Back,https://i0.wp.com/www.strengthlog.com/wp-content/uploads/2020/10/clean.gif?resize=600%2C600&ssl=1,https://i0.wp.com/www.strengthlog.com/wp-content/uploads/2020/10/Muscles-worked-by-clean-exercise-1024x1024.png?resize=700%2C700&ssl=1,"The clean is an exercise that develops power and strength in your lower body, and it has long been a staple when it comes to complementary training for other sports. The type of clean where it is possible to lift the most weight is the one where you squat deep to receive the bar – sometimes known as a squat clean. This variant can, however, be quite technically demanding, and a slightly easier variant is the power clean, where you only bend your knees slightly when receiving the bar.",https://www.strengthlog.com/clean/,5,180
Clean and Jerk,Back,https://i0.wp.com/www.strengthlog.com/wp-content/uploads/2020/10/clean-and-jerk.gif?resize=600%2C600&ssl=1,https://i0.wp.com/www.strengthlog.com/wp-content/uploads/2020/10/Muscles-worked-by-clean-and-jerk.png?resize=700%2C700&ssl=1,"The clean and jerk is a classic barbell exercise, and one of the competition lifts in weightlifting. As the name suggests, the exercise is composed of two separate lifts: the clean, in which you lift the bar from the floor to the front of the shoulders, and the jerk, in which you push the bar up to straight arms over your head. Both lifts are also commonly trained separately, and can be done with many variations. The clean and jerk develop your explosive strength and power in almost your entire body.",https://www.strengthlog.com/clean-and-jerk/,5,180
Deadlift,Back,https://i0.wp.com/www.strengthlog.com/wp-content/uploads/2020/11/Deadlift.gif?resize=600%2C600&ssl=1,https://i0.wp.com/www.strengthlog.com/wp-content/uploads/2020/04/Deadlift-muscles-worked.png?resize=700%2C700&ssl=1,,https://www.strengthlog.com/deadlift/,5,180
Deficit Deadlift,Back,https://i0.wp.com/www.strengthlog.com/wp-content/uploads/2020/02/Defifict-deadlift.gif?resize=600%2C600&ssl=1,https://i0.wp.com/www.strengthlog.com/wp-content/uploads/2020/10/Muscles-worked-by-deficit-deadlifts.jpg?resize=700%2C700&ssl=1,"The deficit deadlift is a variant of the deadlift where you pull the bar standing on an elevation. This makes the lift harder due to more inefficient moment arms, and also increases the workload of the quadriceps. Deficit deadlifts are generally considered to be effective for increasing your strength off the floor in the regular deadlift.",https://www.strengthlog.com/deficit-deadlift/,5,180
Dumbbell Deadlift,Back,https://i0.wp.com/www.strengthlog.com/wp-content/uploads/2020/10/dumbbell-deadlift.gif?resize=600%2C600&ssl=1,https://i0.wp.com/www.strengthlog.com/wp-content/uploads/2020/10/Muscles-worked-by-dumbbell-deadlift.png?resize=700%2C700&ssl=1,"The dumbbell deadlift is an exercise variant that differs from the traditional barbell deadlift in several ways. Two advantages of the dumbbell deadlift are that it is easy to learn, and you can drop the weights at any moment if you need to. That can make this exercise suitable for beginners, children och the elderly, for example. A disadvantage compared to the barbell deadlift is that it is difficult to use very heavy weights in this exercise, which means that you eventually might have difficulties increasing the load.",https://www.strengthlog.com/dumbbell-deadlift/,5,120
Dumbbell Row,Back,https://i0.wp.com/www.strengthlog.com/wp-content/uploads/2020/03/Dumbbell-Row.gif?resize=600%2C600&ssl=1,https://i0.wp.com/www.strengthlog.com/wp-content/uploads/2023/03/muscles-worked-dumbbell-row-2.png?resize=700%2C700&ssl=1,,https://www.strengthlog.com/dumbbell-row/,5,120
Dumbbell Shrug,Back,https://i0.wp.com/www.strengthlog.com/wp-content/uploads/2020/03/Dumbbell-Shrug.gif?resize=600%2C600&ssl=1,https://i0.wp.com/www.strengthlog.com/wp-content/uploads/2023/07/Muscles-worked-by-dumbbell-shrug.png?resize=700%2C700&ssl=1,,https://www.strengthlog.com/dumbbell-shrug/,5,120
Floor Back Extension,Back,https://i0.wp.com/www.strengthlog.com/wp-content/uploads/2023/03/floor-back-extension.gif?resize=600%2C600&ssl=1,,Floor back extensions are a great exercise to do at home since it does not require any equipment. It could also serve as a warmup exercise if you want to activate your lower back.,https://www.strengthlog.com/floor-back-extension/,5,120
Good Morning,Back,https://i0.wp.com/www.strengthlog.com/wp-content/uploads/2020/02/Good-morning.gif?resize=600%2C600&ssl=1,https://i0.wp.com/www.strengthlog.com/wp-content/uploads/2020/09/Muscles-worked-in-the-good-morning-exercise-1024x1024.jpg?resize=700%2C700&ssl=1,The good morning is an exercise that trains your core effectively. Many use it as an assistance exercise for the squat and the deadlift. Try different foot and bar positions to find what you like best. Many people seem to prefer a rather wide stance and placing the bar low on their back.,https://www.strengthlog.com/good-morning/,5,180
Gorilla Row,Back,https://i0.wp.com/www.strengthlog.com/wp-content/uploads/2024/11/gorilla-row-dumbbells.gif?resize=600%2C600&ssl=1,https://i0.wp.com/www.strengthlog.com/wp-content/uploads/2024/11/muscles-worked-gorilla-row2.png?resize=700%2C700&ssl=1,"The gorilla row is a powerful exercise for building strength and stability in the upper back, lats, and core. It can be done with dumbbells or kettlebells.",https://www.strengthlog.com/gorilla-row/,5,120
Hang Clean,Back,https://i0.wp.com/www.strengthlog.com/wp-content/uploads/2020/10/hang-clean.gif?resize=600%2C600&ssl=1,https://i0.wp.com/www.strengthlog.com/wp-content/uploads/2020/10/Muscles-worked-by-hang-clean-exercise-1024x1024.png?resize=700%2C700&ssl=1,"The hang clean is a variant of the clean exercise, in which you have removed the first pull from the floor. This makes the hang clean a potentially easier variant to begin with for learning the clean, since you don’t have to focus on as many steps.",https://www.strengthlog.com/hang-clean/,5,180
Hang Power Clean,Back,https://i0.wp.com/www.strengthlog.com/wp-content/uploads/2020/10/hang-power-clean.gif?resize=600%2C600&ssl=1,https://i0.wp.com/www.strengthlog.com/wp-content/uploads/2020/10/Muscles-worked-by-hang-power-clean.jpg?resize=700%2C700&ssl=1,"The hang power clean is a variant of the clean exercise, in which you have removed the first pull from the floor, and you also don’t catch the bar in as deep of a squat position. This makes the hang power clean a potentially easier variant to begin with for learning the clean, since you don’t have to focus on as many steps, and also the mobility demands are not as high.",https://www.strengthlog.com/hang-power-clean/,5,180
Hang Power Snatch,Back,https://i0.wp.com/www.strengthlog.com/wp-content/uploads/2020/10/hang-power-snatch.gif?resize=600%2C600&ssl=1,https://i0.wp.com/www.strengthlog.com/wp-content/uploads/2020/10/Muscles-worked-by-hang-power-snatch-exercise-1024x1024.png?resize=700%2C700&ssl=1,"The hang power snatch is a variant of the snatch exercise, in which you have removed the first pull from the floor, and you also don’t catch the bar in as deep of a squat position. This makes the hang power snatch a potentially easier variant to begin with for learning the snatch, since you don’t have to focus on as many steps, and also the mobility demands are not as high.",https://www.strengthlog.com/hang-power-snatch/,5,180
Hang Snatch,Back,https://i0.wp.com/www.strengthlog.com/wp-content/uploads/2020/10/hang-snatch.gif?resize=600%2C600&ssl=1,https://i0.wp.com/www.strengthlog.com/wp-content/uploads/2020/10/Muscles-worked-in-the-barbell-hang-snatch-exercise-1024x1024.png?resize=700%2C700&ssl=1,"The hang snatch is a variant of the snatch exercise, in which you have removed the first pull from the floor. This makes the hang snatch a potentially easier variant to begin with for learning the snatch, since you don’t have to focus on as many steps.",https://www.strengthlog.com/hang-snatch/,5,180
Inverted Row,Back,https://i0.wp.com/www.strengthlog.com/wp-content/uploads/2020/10/hangande-rodd-overhandsgrepp.gif?resize=600%2C600&ssl=1,https://i0.wp.com/www.strengthlog.com/wp-content/uploads/2020/10/Muscles-worked-by-inverted-row.png?resize=700%2C700&ssl=1,"The inverted row is a pulling exercise where you use your own bodyweight as resistance. You can make the exercise heavier by placing your feet on an elevation, or easier by raising the bar to a higher rack position. A variation of this exercise is to do it with an underhand grip, which could increase the involvement of your arm flexors.",https://www.strengthlog.com/inverted-row/,4,120
Inverted Row with Underhand Grip,Back,https://i0.wp.com/www.strengthlog.com/wp-content/uploads/2023/03/inverted-row-with-underhand-grip-new.gif?resize=600%2C600&ssl=1,https://i0.wp.com/www.strengthlog.com/wp-content/uploads/2020/10/Muscles-worked-by-inverted-row-1.png?resize=700%2C700&ssl=1,"The inverted row is a pulling exercise where you use your own bodyweight as resistance. You can make the exercise heavier by placing your feet on an elevation, or easier by raising the bar to a higher rack position. In this variation of the exercise, you do it with an underhand grip, which could increase the involvement of your arm flexors. An alternative is to do the exercise with an overhand grip.",https://www.strengthlog.com/inverted-row-with-underhand-grip/,4,120
Jefferson Curl,Back,https://i0.wp.com/www.strengthlog.com/wp-content/uploads/2023/09/Jefferson-Curl.gif?resize=576%2C1024&ssl=1,https://i0.wp.com/www.strengthlog.com/wp-content/uploads/2023/09/Jefferson-Curl-Muscles-Worked.png?resize=563%2C563&ssl=1,"The Jefferson curl is more of a mobility exercise than a strength training exercise, although it will strengthen your spinal erectors. Start with very light weights, or even no weights at all in the beginning. Use this exercise to increase mobility and control in your back.",https://www.strengthlog.com/jefferson-curl/,5,180
Jumping Muscle-Up,Back,https://i0.wp.com/www.strengthlog.com/wp-content/uploads/2024/03/jumping-ring-muscle-up.gif?resize=600%2C600&ssl=1,https://i0.wp.com/www.strengthlog.com/wp-content/uploads/2024/02/Muscles-worked-in-bar-muscle-up.png?resize=563%2C563&ssl=1,,https://www.strengthlog.com/jumping-muscle-up/,4,180
Kettlebell Swing,Back,https://i0.wp.com/www.strengthlog.com/wp-content/uploads/2020/02/Kettlebellsving.gif?resize=600%2C600&ssl=1,https://i0.wp.com/www.strengthlog.com/wp-content/uploads/2020/09/Muscles-worked-in-the-kettlebell-swing-exercise-1024x1024.jpg?resize=700%2C700&ssl=1,"Remember that it is the power from your hip and back that lifts the kettlebell, not your arms. The kettlebell swing is primarily an exercise for your glutes, back, and posterior thighs, and therefore you shouldn’t bend your knees more than just slightly. If you want to train your quads (front of the thigh) with a kettlebell, then goblet squats or front squats are a better alternative. In order to make the exercise heavier, you can of course use a heavier kettlebell, but another alternative is to hold one lighter kettlebell in each hand. Another alternative is one-handed kettlebell swings, where you hold a single kettlebell in only one hand. This will have you fighting to resist the rotational pull of the kettlebell, and thus increasing the training effect of the obliques. Lastly, the kettlebell swing is an exercise that is also suited for cardio training, for example by training short, intensive intervals.",https://www.strengthlog.com/kettlebell-swing/,4,120
Lat Pulldown With Pronated Grip,Back,https://i0.wp.com/www.strengthlog.com/wp-content/uploads/2020/03/lat-pulldown-with-pronated-grip.gif?resize=600%2C600&ssl=1,https://i0.wp.com/www.strengthlog.com/wp-content/uploads/2020/10/Muscles-worked-by-lat-pulldown-with-pronated-grip.png?resize=700%2C700&ssl=1,,https://www.strengthlog.com/lat-pulldown-with-pronated-grip/,5,120
Lat Pulldown With Supinated Grip,Back,https://i0.wp.com/www.strengthlog.com/wp-content/uploads/2020/04/lat-pulldown-with-supinated-grip.gif?resize=600%2C600&ssl=1,https://i0.wp.com/www.strengthlog.com/wp-content/uploads/2020/10/Muscles-worked-by-Lat-Pulldown-With-Supinated-Grip.png?resize=700%2C700&ssl=1,"Lat pulldowns train both your lats and arm flexors effectively. Common variations of this exercise includes gripping the bar with a pronated (overhand) grip. Another common variation is to use a one-handed grip and train one side at a time, which enables you to focus more on each sides muscles in turn. Lat pulldown is a good exercise to strengthen the muscles necessary to do a pull-up.",https://www.strengthlog.com/lat-pulldown-with-supinated-grip/,5,120
Muscle-Up (Bar),Back,https://i0.wp.com/www.strengthlog.com/wp-content/uploads/2024/02/Bar-Muscle-Up.gif?resize=600%2C600&ssl=1,https://i0.wp.com/www.strengthlog.com/wp-content/uploads/2024/02/Muscles-worked-in-bar-muscle-up.png?resize=563%2C563&ssl=1,,https://www.strengthlog.com/bar-muscle-up/,5,180
Muscle-Up (Rings),Back,https://i0.wp.com/www.strengthlog.com/wp-content/uploads/2024/03/ring-muscle-up.gif?resize=600%2C600&ssl=1,https://i0.wp.com/www.strengthlog.com/wp-content/uploads/2024/02/Muscles-worked-in-bar-muscle-up.png?resize=563%2C563&ssl=1,,https://www.strengthlog.com/ring-muscle-up/,5,180
One-Handed Cable Row,Back,https://i0.wp.com/www.strengthlog.com/wp-content/uploads/2020/04/cable-row-seated-single-arm.gif?resize=600%2C600&ssl=1,https://i0.wp.com/www.strengthlog.com/wp-content/uploads/2020/10/Muscles-worked-by-one-handed-cable-row.png?resize=700%2C700&ssl=1,"Lean forward slightly in the starting position, and lean back slightly in the end position. Let your scapula move freely by letting it slide forward in the starting position, and pull it back in the end position. In this variant you train one arm at a time, which can increase the focus on the trained muscle.",https://www.strengthlog.com/one-handed-cable-row/,5,120
One-Handed Lat Pulldown,Back,https://i0.wp.com/www.strengthlog.com/wp-content/uploads/2020/04/lat-pulldown-single-arm.gif?resize=600%2C600&ssl=1,https://i0.wp.com/www.strengthlog.com/wp-content/uploads/2020/10/Muscles-worked-by-One-Handed-Lat-Pulldown.png?resize=700%2C700&ssl=1,"Lat pulldowns train both your lats and arm flexors effectively. By training one side at a time, you are enabled to focus more on each sides muscles in turn.",https://www.strengthlog.com/one-handed-lat-pulldown/,5,120
