Exercise Name,Muscle Group,Exercise Image URL,Muscles Worked Image,Commentary,Page URL,Avg Rep,Avg Break
Pause Deadlift,Back,https://i0.wp.com/www.strengthlog.com/wp-content/uploads/2020/02/Pause-deadlift.gif?resize=600%2C600&ssl=1,https://i0.wp.com/www.strengthlog.com/wp-content/uploads/2020/10/Muscles-worked-by-pause-deadlifts.jpg?resize=700%2C700&ssl=1,,https://www.strengthlog.com/pause-deadlift/,5,180
Pendlay Row,Back,https://i0.wp.com/www.strengthlog.com/wp-content/uploads/2020/10/pendlay-row.gif?resize=600%2C600&ssl=1,https://i0.wp.com/www.strengthlog.com/wp-content/uploads/2020/10/Muscles-worked-by-pendlay-row-exercise-1024x1024.jpg?resize=700%2C700&ssl=1,"The pendlay row is a variant of the barbell row where you keep your upper body fixated throughout the movement. Only the bar and your arms are moving, and you put the bar back on the floor between each repetition. This means that you will avoid some of the static work for your core and lower back that you otherwise get from doing barbell rows. Instead, you will get to practice how to build up tension in those muscles in each rep.",https://www.strengthlog.com/pendlay-row/,5,180
Power Clean,Back,https://i0.wp.com/www.strengthlog.com/wp-content/uploads/2020/10/power-clean.gif?resize=600%2C600&ssl=1,https://i0.wp.com/www.strengthlog.com/wp-content/uploads/2020/10/Muscles-worked-by-power-clean.png?resize=700%2C700&ssl=1,"The power clean is a variant of the clean, where you catch the bar at a higher position. Because you’re not catching the bar in such a deep squat position, many find this exercise technically easier to perform. A disadvantage, however, is that you’re not able to lift as much weight in the power clean as in the clean, since you have to lift the bar even higher, because of the higher catch position. However, the power clean is still an excellent exercise to develop your explosive strength in the lower body.",https://www.strengthlog.com/power-clean/,5,180
Power Snatch,Back,https://i0.wp.com/www.strengthlog.com/wp-content/uploads/2020/10/power-snatch.gif?resize=600%2C600&ssl=1,https://i0.wp.com/www.strengthlog.com/wp-content/uploads/2020/10/Muscles-worked-by-power-snatch-exercise-1024x1024.png?resize=700%2C700&ssl=1,"The power snatch is a variant of the snatch, where you catch the bar in a higher position. Because you’re not catching the bar in such a deep squat position, many find this exercise technically easier to perform. A disadvantage, however, is that you’re not able to lift as much weight in the power snatch as in the snatch, since you have to lift the bar even higher, because of the higher catch position. However, the power snatch is still an excellent exercise to develop your explosive strength in the lower body.",https://www.strengthlog.com/power-snatch/,5,180
Pull-Up,Back,https://i0.wp.com/www.strengthlog.com/wp-content/uploads/2020/03/pull-up.gif?resize=600%2C600&ssl=1,https://i0.wp.com/www.strengthlog.com/wp-content/uploads/2020/10/Muscles-worked-by-pull-ups.png?resize=700%2C700&ssl=1,"Pull-ups train both your lats and arm flexors effectively. By using a grip slightly wider than shoulder-width, you get a good range of motion and high muscle activation in all the working muscles. You can make the exercise heavier by adding extra weight, i.e., in a weight belt, or make it easier by slinging a rubber band around the bar and under your feet. A common variation of this exercise is to grip the bar with a supinated (underhand) grip, which makes it possible to put more focus on your arm flexors.",https://www.strengthlog.com/pull-up/,4,120
Pull-Up With a Neutral Grip,Back,https://i0.wp.com/www.strengthlog.com/wp-content/uploads/2024/02/chins-neutralt-grepp.gif?resize=600%2C600&ssl=1,https://i0.wp.com/www.strengthlog.com/wp-content/uploads/2020/10/Muscles-worked-by-chin-ups.png?resize=700%2C700&ssl=1,"Chin-ups train both your lats and arm flexors effectively. With a neutral grip like in this exercise, you make it possible to focus even more on your arm flexors if you want to. You can make the exercise heavier by adding extra weight, i.e. in a weight belt, or make it easier by slinging a rubber band around the bar and under your feet.",https://www.strengthlog.com/pull-ups-with-a-neutral-grip/,4,120
Rack Pull,Back,https://i0.wp.com/www.strengthlog.com/wp-content/uploads/2020/02/Rack-pull.gif?resize=600%2C600&ssl=1,https://i0.wp.com/www.strengthlog.com/wp-content/uploads/2021/12/Rack-pull-muscles-worked.jpg?resize=700%2C700&ssl=1,,https://www.strengthlog.com/rack-pull/,5,180
Ring Pull-Up,Back,https://i0.wp.com/www.strengthlog.com/wp-content/uploads/2024/03/ring-pullups.gif?resize=600%2C600&ssl=1,https://i0.wp.com/www.strengthlog.com/wp-content/uploads/2020/10/Muscles-worked-by-chin-ups.png?resize=700%2C700&ssl=1,The ring pull-up is a variation of pull-ups which is great for strengthening your pulling muscles and for preparing you on the road to conquering the muscle-up.,https://www.strengthlog.com/ring-pull-up/,4,120
Ring Row,Back,https://i0.wp.com/www.strengthlog.com/wp-content/uploads/2024/05/ring-rows.gif?resize=600%2C600&ssl=1,https://i0.wp.com/www.strengthlog.com/wp-content/uploads/2024/05/muscles-worked-ring-row.png?resize=700%2C700&ssl=1,The ring row is a great exercise for strengthening your pulling muscles and for preparing you on the road to conquering the muscle-up.,https://www.strengthlog.com/ring-row/,4,120
Scap Pull-Up,Back,https://i0.wp.com/www.strengthlog.com/wp-content/uploads/2024/10/scap-pull-ups.gif?resize=600%2C600&ssl=1,https://i0.wp.com/www.strengthlog.com/wp-content/uploads/2024/10/muscles-worked-scap-pull-ups.png?resize=700%2C700&ssl=1,"Scap pull-ups mimics the first part of a pull-up, and can be a useful exercise for learning what muscles you need to use in a pull-up.",https://www.strengthlog.com/scap-pull-up/,4,120
Seal Row,Back,https://i0.wp.com/www.strengthlog.com/wp-content/uploads/2020/10/seal-row.gif?resize=600%2C600&ssl=1,https://i0.wp.com/www.strengthlog.com/wp-content/uploads/2020/10/Muscles-worked-by-seal-row.png?resize=700%2C700&ssl=1,"The seal row is a variation of the barbell row, where you isolate the work to the rowing muscles in the arms and the back. This is done by lying on a bench and thus off-loading the legs and the core. By isolating the work in this way, it can be easier to focus on and exhaust the trained muscles.",https://www.strengthlog.com/seal-row/,5,180
Seated Machine Row,Back,https://i0.wp.com/www.strengthlog.com/wp-content/uploads/2020/04/seated-machine-row.gif?resize=600%2C600&ssl=1,https://i0.wp.com/www.strengthlog.com/wp-content/uploads/2020/10/Muscles-worked-by-machine-row.jpg?resize=700%2C700&ssl=1,"Machine row is a stable exercise for your pulling muscles, which means that you don’t have to think about balance or trajectory, but can focus on getting contact with the right muscles.",https://www.strengthlog.com/seated-machine-row/,5,120
Single Leg Deadlift with Kettlebell,Back,https://i0.wp.com/www.strengthlog.com/wp-content/uploads/2024/10/single-leg-deadlift-with-kettlebell.gif?resize=600%2C600&ssl=1,https://i0.wp.com/www.strengthlog.com/wp-content/uploads/2024/10/muscles-worked-single-leg-deadlift-with-kettlebell.png?resize=700%2C700&ssl=1,"The Single-Leg Deadlift with Kettlebell is an effective exercise for strengthening the hamstrings, glutes, and core while improving balance and stability. The movement is more similar to a stiff-legged deadlift than a regular deadlift, as it emphasizes the hip hinge, engaging the posterior chain.",https://www.strengthlog.com/single-leg-deadlift-with-kettlebell/,6,180
Smith Machine One-Handed Row,Back,https://i0.wp.com/www.strengthlog.com/wp-content/uploads/2024/11/smith-machine-one-arm-row.gif?resize=600%2C600&ssl=1,https://i0.wp.com/www.strengthlog.com/wp-content/uploads/2024/11/muscles-worked-one-handed-smith-machine-row.png?resize=700%2C700&ssl=1,The single-arm Smith machine row is a variation of the barbell row that allows you to work unilaterally.,https://www.strengthlog.com/smith-machine-one-handed-row/,5,120
Snatch,Back,https://i0.wp.com/www.strengthlog.com/wp-content/uploads/2020/10/snatch.gif?resize=600%2C600&ssl=1,https://i0.wp.com/www.strengthlog.com/wp-content/uploads/2020/10/Muscles-worked-in-the-barbell-snatch-exercise-1024x1024.png?resize=700%2C700&ssl=1,"The snatch is a classic barbell exercise, and also one of the competition lifts in weightlifting. Snatch develops your explosive strength (power) in the lower body, since you need to get the bar moving so fast in such a short amount of time, that it comes high enough for you to catch it. A slightly easier variant of the exercise is the power snatch, in which you don’t catch the bar in such a deep squat position.",https://www.strengthlog.com/snatch/,5,180
Snatch Grip Deadlift,Back,https://i0.wp.com/www.strengthlog.com/wp-content/uploads/2020/10/snatch-deadlift.gif?resize=600%2C600&ssl=1,https://i0.wp.com/www.strengthlog.com/wp-content/uploads/2020/10/Muscles-worked-by-snatch-grip-deadlift.png?resize=700%2C700&ssl=1,"Snatch grip deadlifts, as the name states, is a variant of the regular deadlift where you take a much wider grip – the same as in a snatch. The wider grip means you will have to lean forward and bend your hips, knees and ankles more to reach the bar. Your upper back muscles will also have to work harder to stabilize your shoulders.",https://www.strengthlog.com/snatch-grip-deadlift/,5,180
Stiff-Legged Deadlift,Back,https://i0.wp.com/www.strengthlog.com/wp-content/uploads/2021/10/stiff-leg-deadlifts.gif?resize=600%2C600&ssl=1,https://i0.wp.com/www.strengthlog.com/wp-content/uploads/2020/09/Muscles-worked-by-stiff-legged-deadlifts.jpg?resize=700%2C700&ssl=1,"The stiff-leg deadlift (or straight-leg deadlift) is a variation of the traditional deadlift, where you have almost entirely shifted the work to your posterior chain. This exercise requires good mobility to be performed without rounding your back excessively, and an alternative is to raise the bar up on blocks, plates, or a rack in order to decrease the range of motion slightly.",https://www.strengthlog.com/stiff-legged-deadlift/,5,180
Straight Arm Lat Pulldown,Back,https://i0.wp.com/www.strengthlog.com/wp-content/uploads/2020/12/Straight-arm-lat-pulldown.gif?resize=600%2C600&ssl=1,https://i0.wp.com/www.strengthlog.com/wp-content/uploads/2020/12/Muscles-worked-by-straight-arm-lat-pulldown.jpg?resize=700%2C700&ssl=1,"The straight arm lat pulldown is an exercise that isolates the work to your lats and other muscles that pull your upper arm closer to your body. For a longer range of motion and better muscle contact, you could try to lean slightly forward and bend your knees.",https://www.strengthlog.com/straight-arm-lat-pulldown/,5,120
Sumo Deadlift,Back,https://i0.wp.com/www.strengthlog.com/wp-content/uploads/2020/10/Sumo-deadlift.gif?resize=600%2C600&ssl=1,https://i0.wp.com/www.strengthlog.com/wp-content/uploads/2020/10/Muscles-worked-by-sumo-deadlift.png?resize=700%2C700&ssl=1,"The deadlift is a classic exercise that trains almost your entire body and a competitive event in the sport of powerlifting. This exercise requires great core stability and control, and you should strive to keep your spine straight (neutral) during the entire lift. It is a good idea to experiment with different foot placements to determine which lifting technique suits your body best. The sumo deadlift is a variant of the deadlift, but the most common deadlift variation is standing with much narrower foot placement and gripping the bar with your arms outside of your knees.",https://www.strengthlog.com/sumo-deadlift/,5,180
T-Bar Row,Back,https://i0.wp.com/www.strengthlog.com/wp-content/uploads/2020/04/t-bar-row-machine.gif?resize=600%2C600&ssl=1,https://i0.wp.com/www.strengthlog.com/wp-content/uploads/2020/10/Muscles-worked-by-t-bar-row.jpg?resize=700%2C700&ssl=1,"T-bar rows is a variant of standing rows where the weight and bar path is fixed. That lessens the requirements of balance and stabilization, and can make it easier to focus on the muscles being trained.",https://www.strengthlog.com/t-bar-row/,5,120
Trap Bar Deadlift With High Handles,Back,https://i0.wp.com/www.strengthlog.com/wp-content/uploads/2020/03/Trap-Bar-Deadlift-With-High-Handles.gif?resize=600%2C600&ssl=1,https://i0.wp.com/www.strengthlog.com/wp-content/uploads/2020/10/Muscles-worked-by-trap-bar-deadlifts.png?resize=700%2C700&ssl=1,"The trap bar deadlift is a variant of the classic deadlift with a straight bar. By using a trap bar, you will distribute the workload more evenly between hip and knee extensors, which means that your quads will get more work from deadlifts with a trap bar than with a straight bar. Because of more beneficial moment arms, most people are slightly stronger in trap bar deadlifts compared to straight bar deadlifts. Many models of trap bars have handles in two different heights. Using the higher handles means you will train through a shorter range of motion, but the mobility requirements are not as high.",https://www.strengthlog.com/trap-bar-deadlift-with-high-handles/,5,180
Trap Bar Deadlift With Low Handles,Back,https://i0.wp.com/www.strengthlog.com/wp-content/uploads/2020/03/Trap-Bar-Deadlift-With-Low-Handles.gif?resize=600%2C600&ssl=1,https://i0.wp.com/www.strengthlog.com/wp-content/uploads/2020/10/Muscles-worked-by-trap-bar-deadlifts.png?resize=700%2C700&ssl=1,"The trap bar deadlift is a variant of the classic deadlift with a straight bar. By using a trap bar, you will distribute the workload more evenly between hip and knee extensors, which means that your quads will get more work from deadlifts with a trap bar than with a straight bar. Because of more beneficial moment arms, most people are slightly stronger in trap bar deadlifts compared to straight bar deadlifts. Many models of trap bars have handles in two different heights. Using the lower handles means you will train through a longer range of motion, but the mobility requirements also increase.",https://www.strengthlog.com/trap-bar-deadlift-with-low-handles/,5,180
Banded Side Kicks,Glute,https://i0.wp.com/www.strengthlog.com/wp-content/uploads/2020/03/Banded-Side-Kick.gif?resize=600%2C600&ssl=1,https://i0.wp.com/www.strengthlog.com/wp-content/uploads/2020/10/Muscles-worked-by-banded-side-kicks.png?resize=700%2C700&ssl=1,"Banded side kicks train the muscles that abduct (moves apart) your thighs, like your gluteus medius and parts of gluteus maximus.",https://www.strengthlog.com/banded-side-kick/,,
Cable Pull Through,Glute,https://i0.wp.com/www.strengthlog.com/wp-content/uploads/2020/04/cable-pull-through.gif?resize=600%2C600&ssl=1,https://i0.wp.com/www.strengthlog.com/wp-content/uploads/2020/10/Muscles-worked-by-cable-pull-through.jpg?resize=700%2C700&ssl=1,"This exercise isolates the muscles that extend your hips, primarily the glutes. Because the direction of resistance comes from behind you, you won’t get the same rest in the top position that you often get with free weights. This means that your glutes will be under more constant tension, which might be beneficial for muscle growth.",https://www.strengthlog.com/cable-pull-through/,,
Clamshells,Glute,https://i0.wp.com/www.strengthlog.com/wp-content/uploads/2024/01/clamshell.gif?resize=600%2C600&ssl=1,,Clamshells are commonly used to activate the abductors. They can be made more challenging by putting a band over your knees.   Focus on contact with the glutes through the entire movement!,https://www.strengthlog.com/clamshells/,,
Cossack Squat,Glute,https://i0.wp.com/www.strengthlog.com/wp-content/uploads/2024/10/cossack-squat.gif?resize=600%2C600&ssl=1,https://i0.wp.com/www.strengthlog.com/wp-content/uploads/2024/10/muscles-worked-cossack-squat.png?resize=700%2C700&ssl=1,"The Cossack squat is an exercise for enhancing lower body mobility, balance, and flexibility. It targets the quadriceps, glutes, and inner thigh muscles while challenging ankle and hip flexibility. This exercise is good for building functional strength and increasing hip and leg mobility.",https://www.strengthlog.com/cossack-squat/,,
Death March with Dumbbells,Glute,https://i0.wp.com/www.strengthlog.com/wp-content/uploads/2024/10/dumbbell-deathmarch.gif?resize=600%2C600&ssl=1,https://i0.wp.com/www.strengthlog.com/wp-content/uploads/2024/10/muscles-worked-in-Death-March-with-Dumbbells.png?resize=700%2C700&ssl=1,"The death march targets the hamstrings and glutes, helping to strengthen them while also improving hip mobility.",https://www.strengthlog.com/death-march-with-dumbbells/,,
Donkey Kicks,Glute,https://i0.wp.com/www.strengthlog.com/wp-content/uploads/2024/11/donkey-kicks.gif?resize=600%2C600&ssl=1,https://i0.wp.com/www.strengthlog.com/wp-content/uploads/2024/11/muscles-worked-donkey-kicks.png?resize=700%2C700&ssl=1,"Donkey kicks are a glute-focused exercise that strengthens the glutes, hamstrings, and helps improve hip stability. It’s a great exercise to do at home since it doesn’t require any equipment.",https://www.strengthlog.com/donkey-kicks/,,
Dumbbell Romanian Deadlift,Glute,https://i0.wp.com/www.strengthlog.com/wp-content/uploads/2022/09/romanian-deadlift-with-dumbbells.gif?resize=600%2C600&ssl=1,https://i0.wp.com/www.strengthlog.com/wp-content/uploads/2022/09/Muscles-worked-by-dumbbell-romanian-deadlifts-1024x1024-1-1024x1024.jpg?resize=700%2C700&ssl=1,"The dumbbell Romanian deadlift is a variation of the traditional deadlift, where you have almost entirely shifted the work to your posterior chain.",https://www.strengthlog.com/dumbbell-romanian-deadlift/,,
Dumbbell Frog Pumps,Glute,https://i0.wp.com/www.strengthlog.com/wp-content/uploads/2023/01/Dumbbell-frog-pump.gif?resize=600%2C600&ssl=1,https://i0.wp.com/www.strengthlog.com/wp-content/uploads/2023/01/muscles-worked-frog-pumps.jpg?resize=700%2C700&ssl=1,"The frog pump is a glute exercise that requires no equipment, making it good for home workouts. It can also be used as a warm-up exercise. It’s up to you whether you want to make or avoid eye contact with other people while doing frog pumps.",https://www.strengthlog.com/dumbbell-frog-pumps/,,
Fire Hydrants,Glute,https://i0.wp.com/www.strengthlog.com/wp-content/uploads/2020/06/Fire-Hydrants.gif?resize=510%2C510&ssl=1,,"Fire hydrants is a suitable exercise to do at home, since it does not require any equipment. It can also be used to activate the glutes before a workout. If you want to make it more challenging, you can add a band around your knees or an ankle weight to your leg.",https://www.strengthlog.com/fire-hydrants/,,
Frog Pumps,Glute,https://i0.wp.com/www.strengthlog.com/wp-content/uploads/2023/01/Frog-pump.gif?resize=600%2C600&ssl=1,https://i0.wp.com/www.strengthlog.com/wp-content/uploads/2023/01/muscles-worked-frog-pumps.jpg?resize=700%2C700&ssl=1,"The frog pump is a glute exercise that requires no equipment, making it good for home workouts. It can also be used as a warm-up exercise. It’s up to you whether you want to make or avoid eye contact with other people while doing frog pumps.",https://www.strengthlog.com/frog-pumps/,,
Glute Bridge,Glute,https://i0.wp.com/www.strengthlog.com/wp-content/uploads/2020/06/Glute-Bridge.gif?resize=522%2C522&ssl=1,https://i0.wp.com/www.strengthlog.com/wp-content/uploads/2023/03/Muscles-worked-in-glute-bridge.png?resize=563%2C563&ssl=1,"The glute bridge is a great exercise to activate the glutes. It can serve as a warmup or activation exercise, or be incorporated into your workout. You can make it more challenging by putting a band around your knees or adding a weight on your hips, or by using only one leg (one-legged glute bridge).",https://www.strengthlog.com/glute-bridge/,,
Hip Abduction Against Band,Glute,https://i0.wp.com/www.strengthlog.com/wp-content/uploads/2020/03/Band-Seated-Hip-Abduction.gif?resize=600%2C600&ssl=1,https://i0.wp.com/www.strengthlog.com/wp-content/uploads/2020/10/Muscles-worked-by-hip-abduction-against-band.png?resize=700%2C700&ssl=1,"Hip abduction against band trains the muscles that abduct (spreads) your thighs, like your gluteus medius and parts of gluteus maximus.",https://www.strengthlog.com/hip-abduction-against-band/,,
Hip Abduction Machine,Glute,https://i0.wp.com/www.strengthlog.com/wp-content/uploads/2020/03/hip-abduction-machine.gif?resize=600%2C600&ssl=1,https://i0.wp.com/www.strengthlog.com/wp-content/uploads/2020/10/Muscles-worked-by-hip-abduction-machine.png?resize=700%2C700&ssl=1,"The hip abduction machine trains the muscles that abducts (moves apart) your thighs, like your gluteus medius and parts of gluteus maximus.",https://www.strengthlog.com/hip-abduction-machine/,,
Hip Thrust,Glute,https://i0.wp.com/www.strengthlog.com/wp-content/uploads/2020/02/Hip-thrust.gif?resize=600%2C600&ssl=1,https://i0.wp.com/www.strengthlog.com/wp-content/uploads/2023/03/Muscles-worked-in-barbell-hip-thrust.png?resize=563%2C563&ssl=1,"The hip thrust is an isolation exercise for your hip extensors, particularly your glutes. The exercise can be varied by using either one or two legs, by elevating your feet for a longer range of motion, or by adding an elastic band between your knees to train your hip abductors simultaneously. We recommend placing something between the bar and your pelvis to soften the pressure from the bar, like a folded yoga mat, a towel, or a barbell pad.",https://www.strengthlog.com/hip-thrust/,,
Hip Thrust Machine,Glute,https://i0.wp.com/www.strengthlog.com/wp-content/uploads/2020/04/hip-thrust-machine.gif?resize=600%2C600&ssl=1,https://i0.wp.com/www.strengthlog.com/wp-content/uploads/2023/03/Muscles-worked-in-hip-thrust-machine.png?resize=563%2C563&ssl=1,"The hip thrust is an isolation exercise for your hip extensors, particularly your glutes. The exercise can be varied by using either one or two legs.",https://www.strengthlog.com/hip-thrust-machine/,,
Hip Thrust With Band Around Knees,Glute,https://i0.wp.com/www.strengthlog.com/wp-content/uploads/2020/03/Hip-thrust-with-band-around-knees.gif?resize=600%2C600&ssl=1,https://i0.wp.com/www.strengthlog.com/wp-content/uploads/2023/03/Muscles-Worked-in-Hip-Thrust-With-Band-Around-Knees.png?resize=563%2C563&ssl=1,"The hip thrust is an isolation exercise for your hip extensors, particularly your glutes. By placing an elastic band around your knees, you increase the load on your hip adductors, i.e. your gluteus medius. We recommend placing something between the bar and your pelvis to soften the pressure from the bar, like a folded yoga mat, a towel, or a barbell pad.",https://www.strengthlog.com/hip-thrust-with-band-around-knees/,,
Lateral Walk With Band,Glute,https://i0.wp.com/www.strengthlog.com/wp-content/uploads/2020/03/Banded-Side-Step.gif?resize=600%2C600&ssl=1,https://i0.wp.com/www.strengthlog.com/wp-content/uploads/2020/10/Muscles-worked-by-lateral-walk-with-band.png?resize=700%2C700&ssl=1,"Lateral walk with band trains the muscles that abduct (moves apart) your thighs, like your gluteus medius and parts of gluteus maximus.",https://www.strengthlog.com/lateral-walk-with-band/,,
Machine Glute Kickbacks,Glute,https://i0.wp.com/www.strengthlog.com/wp-content/uploads/2023/01/machine-glute-kickback.gif?resize=600%2C600&ssl=1,,"The Machine Glute Kickback is an alternative to the bodyweight kickback, when you feel like you want to add some more weight.",https://www.strengthlog.com/machine-glute-kickbacks/,,
One-Legged Glute Bridge,Glute,https://i0.wp.com/www.strengthlog.com/wp-content/uploads/2022/09/One-legged-glute-bridge.gif?resize=600%2C600&ssl=1,https://i0.wp.com/www.strengthlog.com/wp-content/uploads/2023/03/Muscles-Worked-in-One-Legged-Glute-Bridges.png?resize=563%2C563&ssl=1,"The glute bridge is a great exercise to activate the glutes. It can serve as a warmup or activation exercise, or be incorporated into your workout. This variant of the glute bridge trains one leg at a time, making it more difficult. You can make it even more challenging by adding a weight on your hips. It is appropriate for performing at home, since it can be quite heavy even without extra weight.",https://www.strengthlog.com/one-legged-glute-bridge/,,
One-Legged Hip Thrust,Glute,https://i0.wp.com/www.strengthlog.com/wp-content/uploads/2020/06/One-Legged-Hip-Thrust.gif?resize=600%2C600&ssl=1,https://i0.wp.com/www.strengthlog.com/wp-content/uploads/2023/03/Muscles-Worked-in-One-Legged-Hip-Thrust.png?resize=563%2C563&ssl=1,"The hip thrust is an isolation exercise for your hip extensors, particularly your glutes. This is a variant of the regular hip thrust where you only use one leg. You can vary the exercise by elevating your foot for a longer range of motion, or add a weight on your hips.",https://www.strengthlog.com/one-legged-hip-thrust/,,
Reverse Hyperextension,Glute,https://i0.wp.com/www.strengthlog.com/wp-content/uploads/2024/05/reverse-hyperextension.gif?resize=600%2C600&ssl=1,https://i0.wp.com/www.strengthlog.com/wp-content/uploads/2024/05/muscles-worked-reverse-hyperextension.png?resize=700%2C700&ssl=1,"Reverse hyperextensions can be a good alternative for those looking to strengthen the lower back and glutes with reduced spinal loading, rehabilitate lower back injuries, or add variety to posterior chain training without the need for heavy lifting.",https://www.strengthlog.com/reverse-hyperextension/,,
Romanian Deadlift,Glute,https://i0.wp.com/www.strengthlog.com/wp-content/uploads/2022/01/Romanian-deadlift.gif?resize=600%2C600&ssl=1,https://i0.wp.com/www.strengthlog.com/wp-content/uploads/2020/09/Muscles-worked-by-romanian-deadlifts.jpg?resize=700%2C700&ssl=1,,https://www.strengthlog.com/romanian-deadlift/,6,180
