Exercise Name,Muscle Group,Exercise Image URL,Muscles Worked Image,Commentary,Page URL,Avg Rep,Avg Break
Resistance Band Curl,Bicep,https://i0.wp.com/www.strengthlog.com/wp-content/uploads/2024/11/resistance-band-curl.gif?resize=600%2C600&ssl=1,https://i0.wp.com/www.strengthlog.com/wp-content/uploads/2024/11/muscles-worked-resistance-band-curl.png?resize=700%2C700&ssl=1,The resistance band curl is a bicep exercise that provides gradually increasing resistance throughout the movement and is gentle on the joints.,https://www.strengthlog.com/resistance-band-curl/,5,120
Spider Curl,Bicep,https://i0.wp.com/www.strengthlog.com/wp-content/uploads/2022/09/spider-curl-does-whatever-a-spider-curl-does-2.gif?resize=600%2C600&ssl=1,https://i0.wp.com/www.strengthlog.com/wp-content/uploads/2022/09/Muscles-worked-in-spider-curl-exercise-1024x1024-1-1024x1024.jpg?resize=700%2C700&ssl=1,"For the best training effect on your arm flexors (i.e., biceps), you should probably maintain a strict form, where your muscles are under constant tension. To accomplish this, you could try to avoid letting your elbows travel backward during the lift, and also keep tension in the muscles in the bottom position.",https://www.strengthlog.com/spider-curl/,5,120
Barbell Standing Triceps Extension,Triceps,https://i0.wp.com/www.strengthlog.com/wp-content/uploads/2020/03/Barbell-Standing-Triceps-Extension.gif?resize=600%2C600&ssl=1,https://i0.wp.com/www.strengthlog.com/wp-content/uploads/2023/07/Muscles-worked-by-standing-tricep-extension-1024x1024.png?resize=700%2C700&ssl=1,,https://www.strengthlog.com/barbell-standing-triceps-extension/,5,120
Barbell Lying Triceps Extension,Triceps,https://i0.wp.com/www.strengthlog.com/wp-content/uploads/2020/03/Barbell-Lying-Tricep-Extension.gif?resize=600%2C600&ssl=1,https://i0.wp.com/www.strengthlog.com/wp-content/uploads/2023/05/muscles-worked-barbell-lying-tricep-extension-2.png?resize=700%2C700&ssl=1,,https://www.strengthlog.com/barbell-lying-triceps-extension/,5,120
Bench Dip,Triceps,https://i0.wp.com/www.strengthlog.com/wp-content/uploads/2022/12/C7251A7B-7A1B-47AE-A88C-7054692BCEF0.gif?resize=600%2C600&ssl=1,https://i0.wp.com/www.strengthlog.com/wp-content/uploads/2021/11/Muscles-worked-in-bench-dips.jpg?resize=700%2C700&ssl=1,"The bench dip is a variant of the bar dip that utilizes a bench instead of a dip station. This exercise puts more emphasis on your triceps than the bar dip does, which instead emphasizes your chest and front delts more.",https://www.strengthlog.com/bench-dip/,5,120
Crossbody Cable Triceps Extension,Triceps,https://i0.wp.com/www.strengthlog.com/wp-content/uploads/2024/11/Crossbody-Cable-Triceps-Extension.gif?resize=600%2C600&ssl=1,https://i0.wp.com/www.strengthlog.com/wp-content/uploads/2024/11/muscles-worked-Crossbody-Cable-Triceps-Extension-1024x1024.png?resize=700%2C700&ssl=1,"This exercise engage the triceps throughout the range of motion, thanks to the constant tension from the cable machine.",https://www.strengthlog.com/crossbody-cable-triceps-extension/,5,120
Close-Grip Push-Up,Triceps,https://i0.wp.com/www.strengthlog.com/wp-content/uploads/2022/09/close-grip-push-up.gif?resize=600%2C600&ssl=1,,"The push-up is a classic bodyweight exercise for the upper body, with the benefit that you don’t need any equipment to perform it. By placing your hands closer together than in the regular push-up, you transfer more of the load to the triceps.",https://www.strengthlog.com/close-grip-push-up/,4,120
Dumbbell Lying Triceps Extension,Triceps,https://i0.wp.com/www.strengthlog.com/wp-content/uploads/2023/03/Lying-Dumbbell-Triceps-Extension-1.gif?resize=600%2C600&ssl=1,https://i0.wp.com/www.strengthlog.com/wp-content/uploads/2022/09/Muscles-worked-by-lying-triceps-extension-1024x1024-2-1024x1024.png?resize=700%2C700&ssl=1,The lying triceps extension is a very effective tricep exercise that besides extending your elbow joint also trains the triceps function to bring your upper arm down towards your midline. You can also perform the dumbbell lying triceps extension on the floor if you work out at home and don’t have a weight bench.,https://www.strengthlog.com/dumbbell-lying-triceps-extension/,5,120
Dumbbell Standing Triceps Extension,Triceps,https://i0.wp.com/www.strengthlog.com/wp-content/uploads/2020/03/Dumbbell-Standing-Triceps-Extension.gif?resize=600%2C600&ssl=1,https://i0.wp.com/www.strengthlog.com/wp-content/uploads/2020/10/Muscles-worked-by-standing-tricep-extension-1024x1024.png?resize=700%2C700&ssl=1,The standing triceps extension is an effective exercise for isolating the tricep muscle. Common variations of this exercise is to use a small barbell or a heavier dumbbell which you hold with both hands.,https://www.strengthlog.com/dumbbell-standing-triceps-extension/,5,120
Overhead Cable Triceps Extension,Triceps,https://i0.wp.com/www.strengthlog.com/wp-content/uploads/2020/04/cable-rope-overhead-triceps-extension.gif?resize=600%2C652&ssl=1,https://i0.wp.com/www.strengthlog.com/wp-content/uploads/2023/07/Muscles-worked-in-Overhead-Cable-Triceps-Extension-1024x1024.png?resize=700%2C700&ssl=1,,https://www.strengthlog.com/overhead-cable-triceps-extension/,5,120
Tricep Bodyweight Extension,Triceps,https://i0.wp.com/www.strengthlog.com/wp-content/uploads/2023/02/Bodyweight-triceps-extension.gif?resize=600%2C600&ssl=1,,"This is a good alternative for triceps training if you don’t have access to free weights. If you want to make the movement easier, set the bar higher. If you want to make it harder, set it lower.",https://www.strengthlog.com/triceps-bodyweight-extension/,4,120
Tricep Pushdown With Bar,Triceps,https://i0.wp.com/www.strengthlog.com/wp-content/uploads/2020/03/triceps-pushdown-with-straight-handle.gif?resize=600%2C600&ssl=1,https://i0.wp.com/www.strengthlog.com/wp-content/uploads/2023/05/muscles-worked-in-tricep-pushdown-2.png?resize=700%2C700&ssl=1,,https://www.strengthlog.com/tricep-pushdown-with-bar/,5,120
Tricep Pushdown With Rope,Triceps,https://i0.wp.com/www.strengthlog.com/wp-content/uploads/2020/03/triceps-pushdown-with-rope.gif?resize=600%2C600&ssl=1,https://i0.wp.com/www.strengthlog.com/wp-content/uploads/2023/07/Muscles-worked-by-triceps-pushdown.png?resize=700%2C700&ssl=1,,https://www.strengthlog.com/tricep-pushdown-with-rope/,5,120
Air Squat,Leg,https://i0.wp.com/www.strengthlog.com/wp-content/uploads/2020/02/Air-squat.gif?resize=600%2C600&ssl=1,https://i0.wp.com/www.strengthlog.com/wp-content/uploads/2020/10/Muscles-worked-by-air-squats.jpg?resize=700%2C700&ssl=1,"The air squat is a classic exercise that requires no equipment. For the beginner, this exercise might initiate a strength gain all on its own, and for the more experienced trainee it might serve as a mobility-increasing exercise, warm-up or rehabilitation. You can aid your balance in this exercise by holding out your arms in front of you, or even holding a light weight, like in a goblet squat.",https://www.strengthlog.com/air-squat/,3,120
Barbell Hack Squat,Leg,https://i0.wp.com/www.strengthlog.com/wp-content/uploads/2022/04/Barbell-Hack-Squat-Exercise.gif?resize=600%2C600&ssl=1,https://i0.wp.com/www.strengthlog.com/wp-content/uploads/2021/11/Barbell-Hack-Squat-Muscles-Worked.jpg?resize=700%2C700&ssl=1,"The barbell hack squat is an old-school lift and an alternative to regular hack squats if you don’t have access to a machine. This exercise is similar to the barbell deadlift, with the difference that the barbell is placed behind your legs instead of in front of them. This forces you into a more upright position and shifts most of the work onto your quadriceps, unlike the deadlift which is more of a posterior chain exercise.",https://www.strengthlog.com/barbell-hack-squat/,5,180
Barbell Lunge,Leg,https://i0.wp.com/www.strengthlog.com/wp-content/uploads/2020/03/Barbell-Lunge.gif?resize=600%2C600&ssl=1,https://i0.wp.com/www.strengthlog.com/wp-content/uploads/2020/10/Muscles-worked-by-barbell-lunge.png?resize=700%2C700&ssl=1,"The lunge is an exercise that not only strengthens your leg muscles, but it can also be used to train your balance, coordination and control. An alternative to using a barbell for external load, is to hold weights (i.e. dumbbells or kettlebells) in your hands. An alternative way to perform this exercise, that might feel easier on your knees, is to take a step backward instead of forward.",https://www.strengthlog.com/barbell-lunge/,5,120
Barbell Walking Lunge,Leg,https://i0.wp.com/www.strengthlog.com/wp-content/uploads/2023/02/Barbell-walking-lunges.gif?resize=600%2C600&ssl=1,,"The lunge is an exercise that not only strengthens your leg muscles, it can also be used to train your balance, coordination, and knee control. An alternative to the walking lunges is to stay in one place, performing all reps for one leg first before switching to the other.",https://www.strengthlog.com/barbell-walking-lunges/,5,120
Belt Squat,Leg,https://i0.wp.com/www.strengthlog.com/wp-content/uploads/2023/01/belt-squat.gif?resize=600%2C600&ssl=1,,"The belt squat is a good alternative to the Barbell Squat. The movement is similar, but the weight placement helps you put less tension on your lower back.",https://www.strengthlog.com/belt-squats/,5,180
Body Weight Lunge,Leg,https://i0.wp.com/www.strengthlog.com/wp-content/uploads/2022/09/Bodyweight-Lunge-exercise.gif?resize=600%2C600&ssl=1,https://i0.wp.com/www.strengthlog.com/wp-content/uploads/2020/10/Muscles-worked-by-bodyweight-lunge.jpg?resize=700%2C700&ssl=1,"The lunge is a body weight exercise that not only strengthens your leg muscles, but it can also be used to train your balance, coordination and control. You can make the exercise heavier by holding weights in your hands. An alternative way to perform this exercise, that might feel easier on your knees, is to take a step backward instead of forward.",https://www.strengthlog.com/body-weight-lunge/,5,120
Bodyweight Leg Curl,Leg,https://i0.wp.com/www.strengthlog.com/wp-content/uploads/2024/01/body-weight-leg-curl.gif?resize=600%2C600&ssl=1,https://i0.wp.com/www.strengthlog.com/wp-content/uploads/2024/01/muscles-worked.png?resize=700%2C700&ssl=1,This is an alternative to strengthen your hamstrings even if you can’t access a barbell or dumbbells. All you need is a pair of socks (or a towel) and a kitchen floor or hardwood floor.,https://www.strengthlog.com/bodyweight-leg-curl/,4,120
Box Jump,Leg,https://i0.wp.com/www.strengthlog.com/wp-content/uploads/2024/10/box-jump.gif?resize=600%2C600&ssl=1,https://i0.wp.com/www.strengthlog.com/wp-content/uploads/2024/10/muscles-worked-box-jump.png?resize=700%2C700&ssl=1,"Box Jumps are a plyometric exercise that develops explosiveness, power, and coordination. They target the lower body and improve cardiovascular endurance. >> Return to exercise directory.",https://www.strengthlog.com/box-jump/,3,120
Box Squat,Leg,https://i0.wp.com/www.strengthlog.com/wp-content/uploads/2020/10/Box-Squat.gif?resize=600%2C600&ssl=1,https://i0.wp.com/www.strengthlog.com/wp-content/uploads/2020/10/Muscles-worked-by-box-squat.png?resize=700%2C700&ssl=1,"The box squat is a variant of the squat where you use a box (or bench or similar) to squat down against. The exercise can be performed in several ways. One way is to only slightly touch the box with your glutes when you squat. That is: you never really put much of your weight at all on the box. Used this way, the box can serve as an indicator for you, helping you make sure that you are reaching your desired depth. Another common way to perform the exercise, is to actually sit down and put your weight on the box for a few moments, before you rise up again. Used this way, box squats can spare your joints from the otherwise high forces that are generated when you turn in the bottom of a squat. It can also teach positional awareness and train force generation from the bottom.",https://www.strengthlog.com/box-squat/,5,180
Bulgarian Split Squat,Leg,https://i0.wp.com/www.strengthlog.com/wp-content/uploads/2023/02/Bulgarian-split-squat-barbell.gif?resize=600%2C600&ssl=1,,,https://www.strengthlog.com/bulgarian-split-squat/,5,180
Chair Squat,Leg,https://i0.wp.com/www.strengthlog.com/wp-content/uploads/2023/03/chair-squats.gif?resize=600%2C600&ssl=1,https://i0.wp.com/www.strengthlog.com/wp-content/uploads/2021/01/Muscles-worked-by-chair-squats.jpg?resize=700%2C700&ssl=1,"This is the home version of the box squat. It is suitable if you can not do a squat with full depth yet, or if you want to restrict the depth because of an injury.",https://www.strengthlog.com/chair-squats/,5,120
Dumbbell Lunge,Leg,https://i0.wp.com/www.strengthlog.com/wp-content/uploads/2020/03/Dumbbell-Lunge.gif?resize=600%2C600&ssl=1,https://i0.wp.com/www.strengthlog.com/wp-content/uploads/2020/10/Muscles-worked-by-dumbbell-lunge.png?resize=700%2C700&ssl=1,"The lunge is an exercise that not only strengthens your leg muscles, but it can also be used to train your balance, coordination and control. An alternative way to perform this exercise, that might feel easier on your knees, is to take a step backward instead of forward.",https://www.strengthlog.com/dumbbell-lunge/,5,120
Dumbbell Squat,Leg,https://i0.wp.com/www.strengthlog.com/wp-content/uploads/2024/10/dumbbell-squat.gif?resize=600%2C600&ssl=1,https://i0.wp.com/www.strengthlog.com/wp-content/uploads/2020/10/Muscles-worked-by-dumbbell-squats.png?resize=700%2C700&ssl=1,"The dumbbell squat is a squatting variant that differs from the traditional barbell squat in several ways. Two advantages of the dumbbell squat are that it is easy to learn, and you can drop the weights at any moment if you need to. That can make this exercise suitable for beginners, children och the elderly, for example. A disadvantage compared to the barbell squat is that it is difficult to use very heavy weights in this exercise, which means that you eventually might have difficulties increasing the load. If you are having trouble squatting deep, try letting go of one dumbbell, and hold the other one in both hands in front of you, against your chest. See goblet squat for a demonstration.",https://www.strengthlog.com/dumbbell-squat/,5,120
Front Squat,Leg,https://i0.wp.com/www.strengthlog.com/wp-content/uploads/2021/09/Front-squat.gif?resize=600%2C595&ssl=1,https://i0.wp.com/www.strengthlog.com/wp-content/uploads/2020/09/Muscles-worked-in-the-front-squat-exercise-1024x1024.jpg?resize=700%2C700&ssl=1,"The front squat is a variation of the barbell squat. This exercise shifts more work to your quadriceps, and also your back muscles have to work against a longer moment arm. The exercise mimics the catch position of a clean, and it is therefore a common exercise among Olympic weightlifters. Because the center of gravity is shifted forward compared to a regular squat, many find it easier to get deep in the front squat. However, the mobility demands increase in other joints, such as your ankles (which can be helped by lifting shoes with a raised heel) and in your shoulders and wrists. The latter might be solved by using an alternate grip: either by crossing your lower arms and placing your hands on top of the bar or by pulling lifting straps around the bar and holding onto these.",https://www.strengthlog.com/front-squat/,5,180
Glute Ham Raise,Leg,https://i0.wp.com/www.strengthlog.com/wp-content/uploads/2024/11/glute-ham-raise.gif?resize=600%2C600&ssl=1,https://i0.wp.com/www.strengthlog.com/wp-content/uploads/2024/11/muscles-worked-glute-ham-raise.png?resize=700%2C700&ssl=1,"The glute ham raise is an excellent exercise for strengthening the hamstrings and glutes. It provides effective isolation of the posterior thigh muscles, improving both strength and endurance",https://www.strengthlog.com/glute-ham-raise/,5,180
Goblet Squat,Leg,https://i0.wp.com/www.strengthlog.com/wp-content/uploads/2020/02/Goblet-squat.gif?resize=600%2C600&ssl=1,https://i0.wp.com/www.strengthlog.com/wp-content/uploads/2020/10/Muscles-worked-by-goblet-squat.jpg?resize=700%2C700&ssl=1,,https://www.strengthlog.com/goblet-squat/,5,120
Hack Squat Machine,Leg,https://i0.wp.com/www.strengthlog.com/wp-content/uploads/2020/04/hack-squat-machine.gif?resize=600%2C600&ssl=1,https://i0.wp.com/www.strengthlog.com/wp-content/uploads/2020/10/Muscles-worked-by-hack-squat-machine.png?resize=700%2C700&ssl=1,,https://www.strengthlog.com/hack-squat-machine/,5,180
Half Air Squat,Leg,https://i0.wp.com/www.strengthlog.com/wp-content/uploads/2023/03/half-air-squats.gif?resize=600%2C600&ssl=1,https://i0.wp.com/www.strengthlog.com/wp-content/uploads/2021/01/Muscles-worked-by-half-squats.jpg?resize=700%2C700&ssl=1,"The air squat is a classic exercise that requires no equipment. For the beginner, this exercise might initiate a strength gain all on it’s own, and for the more experienced trainee it might serve as a mobility-increasing exercise, warm-up or rehabilitation. You can aid your balance in this exercise by holding out your arms in front of you, or even holding a light weight, like in a goblet squat. This version of the air squat is suitable if you can not do a squat with full depth yet, or if you want to restrict the depth because of an injury.",https://www.strengthlog.com/half-body-weight-squats/,3,120
Hip Adduction Machine,Leg,https://i0.wp.com/www.strengthlog.com/wp-content/uploads/2020/03/hip-adduction-machine.gif?resize=600%2C600&ssl=1,https://i0.wp.com/www.strengthlog.com/wp-content/uploads/2020/10/Muscles-worked-by-hip-adduction-machine.png?resize=700%2C700&ssl=1,The hip adduction machine trains the muscles that adduct (brings together) your thighs.,https://www.strengthlog.com/hip-adduction-machine/,5,120
Jumping Lunge,Leg,https://i0.wp.com/www.strengthlog.com/wp-content/uploads/2024/01/jumping-lunges.gif?resize=600%2C600&ssl=1,https://i0.wp.com/www.strengthlog.com/wp-content/uploads/2024/02/muscles-workes-in-jumping-lunges.png?resize=700%2C700&ssl=1,"Jumping lunges are an alternative to regular lunges. The explosive jumping motion enhances muscle power and agility, targeting more muscle groups than a regular lunge. It’s an excellent way to improve balance and coordination while making it a highly efficient exercise for those looking to elevate their workout intensity.",https://www.strengthlog.com/jumping-lunges/,3,120
Landmine Hack Squat,Leg,https://i0.wp.com/www.strengthlog.com/wp-content/uploads/2022/04/Landmine-Hack-Squat-Exercise.gif?resize=600%2C600&ssl=1,https://i0.wp.com/www.strengthlog.com/wp-content/uploads/2021/11/Landmine-Hack-Squat-Muscles-Worked.jpg?resize=700%2C700&ssl=1,"The landmine hack squat is a blend of the hack squat and the landmine squat. In similarity to these exercises, the landmine hack squat primarily targets your leg muscles and does not place a lot of load on your lower back. This exercise can be a good choice if you want to emphasize your quadriceps muscles in a relatively stable exercise, but don’t have access to a hack squat machine.",https://www.strengthlog.com/landmine-hack-squat/,5,180
Landmine Squat,Leg,https://i0.wp.com/www.strengthlog.com/wp-content/uploads/2022/04/Landmine-Squat-Exercise.gif?resize=600%2C600&ssl=1,https://i0.wp.com/www.strengthlog.com/wp-content/uploads/2021/11/Landmine-squat-muscles-worked.jpg?resize=700%2C700&ssl=1,"The landmine squat is a relatively stable squatting exercise that doesn’t require a lot of mobility or tax your lower back very much. In terms of muscles worked and the overall feel, it somewhat resembles the goblet squat or front squat. This exercise is a good choice when you want to work your legs in a stable exercise that doesn’t put a lot of load on your lower back, but you don’t have access to a leg press or hack squat machine. Another variation of this exercise is the landmine hack squat.",https://www.strengthlog.com/landmine-squat/,5,180
Leg Curl On Ball,Leg,https://i0.wp.com/www.strengthlog.com/wp-content/uploads/2024/02/Leg-curl-on-ball.gif?resize=600%2C600&ssl=1,https://i0.wp.com/www.strengthlog.com/wp-content/uploads/2024/01/muscles-worked.png?resize=700%2C700&ssl=1,Leg curls are effective for strengthening the hamstrings and glutes. Using an exercise ball isn’t just a good alternative if you don’t have access to a leg curl machine; it also helps to improve your balance and core stability.,https://www.strengthlog.com/leg-curl-on-ball/,4,120
Leg Extension,Leg,https://i0.wp.com/www.strengthlog.com/wp-content/uploads/2020/03/leg-extension-seated.gif?resize=600%2C600&ssl=1,https://i0.wp.com/www.strengthlog.com/wp-content/uploads/2023/05/muscles-worked-in-leg-extension-2.png?resize=700%2C700&ssl=1,,https://www.strengthlog.com/leg-extension/,5,120
Leg Press,Leg,https://i0.wp.com/www.strengthlog.com/wp-content/uploads/2020/03/leg-press.gif?resize=600%2C600&ssl=1,https://i0.wp.com/www.strengthlog.com/wp-content/uploads/2020/10/Muscles-worked-by-leg-press.png?resize=700%2C700&ssl=1,,https://www.strengthlog.com/leg-press/,5,180
Lying Leg Curl,Leg,https://i0.wp.com/www.strengthlog.com/wp-content/uploads/2020/03/leg-curl-lying.gif?resize=600%2C600&ssl=1,https://i0.wp.com/www.strengthlog.com/wp-content/uploads/2020/10/Muscles-worked-by-lying-leg-curl.png?resize=700%2C700&ssl=1,The lying leg curl is an isolation exercise where it is easy to focus on the hamstrings. Be careful when adjusting the machine so that it suits your body. The most important aspect is to place the machine’s joint in line with your knees.,https://www.strengthlog.com/lying-leg-curl/,5,120
Nordic Hamstring Eccentric,Leg,https://i0.wp.com/www.strengthlog.com/wp-content/uploads/2024/05/nordic-hamstrings-eccentric.gif?resize=600%2C600&ssl=1,https://i0.wp.com/www.strengthlog.com/wp-content/uploads/2023/05/muscles-worked-seated-leg-curl.png?resize=700%2C700&ssl=1,This exercise emphasizes eccentric hamstring strength and can help prevent injury while improving overall posterior chain stability.,https://www.strengthlog.com/nordic-hamstring-eccentric/,6,180
Pause Squat,Leg,https://i0.wp.com/www.strengthlog.com/wp-content/uploads/2020/10/Pause-squat.gif?resize=600%2C600&ssl=1,https://i0.wp.com/www.strengthlog.com/wp-content/uploads/2020/10/Muscles-worked-by-pause-squat.png?resize=700%2C700&ssl=1,,https://www.strengthlog.com/pause-squat/,5,180
Pistol Squat,Leg,https://i0.wp.com/www.strengthlog.com/wp-content/uploads/2024/11/Pistol-squat.gif?resize=600%2C600&ssl=1,https://i0.wp.com/www.strengthlog.com/wp-content/uploads/2024/11/muscles-worked-pistol-squat.png?resize=700%2C700&ssl=1,"The Pistol Squat is a challenging unilateral exercise that builds strength, balance, and mobility in the lower body. It’s excellent for targeting the quads, glutes, and stabilizing muscles.",https://www.strengthlog.com/pistol-squat/,5,120
Reverse Barbell Lunge,Leg,https://i0.wp.com/www.strengthlog.com/wp-content/uploads/2024/05/reverse-barbell-lunge.gif?resize=600%2C600&ssl=1,https://i0.wp.com/www.strengthlog.com/wp-content/uploads/2024/05/muscles-worked-in-reverse-barbell-lunge.png?resize=700%2C700&ssl=1,"The lunge is an exercise that not only strengthens your leg muscles, it can also be used to train your balance, coordination, and knee control. An alternative to using a barbell for external load is to hold weights (i.e., dumbbells or kettlebells) in your hands. An alternative way to perform this exercise is to take a step forward instead of backward.",https://www.strengthlog.com/reverse-barbell-lunge/,5,120
Romanian Deadlift,Leg,https://i0.wp.com/www.strengthlog.com/wp-content/uploads/2022/01/Romanian-deadlift.gif?resize=600%2C600&ssl=1,https://i0.wp.com/www.strengthlog.com/wp-content/uploads/2020/09/Muscles-worked-by-romanian-deadlifts.jpg?resize=700%2C700&ssl=1,,https://www.strengthlog.com/romanian-deadlift/,6,180
Safety Bar Squat,Leg,https://i0.wp.com/www.strengthlog.com/wp-content/uploads/2020/11/safetybar-squat.gif?resize=600%2C600&ssl=1,https://i0.wp.com/www.strengthlog.com/wp-content/uploads/2020/11/Muscles-worked-by-safety-bar-squat.png?resize=700%2C700&ssl=1,"The safety bar squat is a variant of the classic barbell squat. The design of the bar means that the center of gravity of the weights ends up slightly further forward than they do in a barbell squat, which can make it easier to squat deep with good technique. By gripping handles instead of a straight bar, the requirement for mobility in the shoulders is also reduced somewhat. Experiment with foot placement to find one that feels good.",https://www.strengthlog.com/safety-bar-squat/,5,180
Seated Leg Curl,Leg,https://i0.wp.com/www.strengthlog.com/wp-content/uploads/2020/03/leg-curl-seated.gif?resize=600%2C600&ssl=1,https://i0.wp.com/www.strengthlog.com/wp-content/uploads/2023/05/muscles-worked-seated-leg-curl.png?resize=700%2C700&ssl=1,,https://www.strengthlog.com/seated-leg-curl/,5,120
Shallow Body Weight Lunge,Leg,https://i0.wp.com/www.strengthlog.com/wp-content/uploads/2023/03/shallow-lunges-bw.gif?resize=600%2C600&ssl=1,https://i0.wp.com/www.strengthlog.com/wp-content/uploads/2021/01/Muscles-worked-by-shallow-lunge.png?resize=700%2C700&ssl=1,"The lunge is a body weight exercise that not only strengthens your leg muscles, but it can also be used to train your balance, coordination and control. You can make the exercise heavier by holding weights in your hands. Shallow lunges is an easier edition of the body weight lunge. It is a suitable exercise if you can not do lunges with full depth yet, or if you want to restrict the depth due to an injury.",https://www.strengthlog.com/shallow-lunges-bodyweight/,4,120
